"ID","Category","Question","Answer","Status","ResponseTimeMs","Timestamp","ErrorMessage"
"1","إجازات","ابغى اعرف كيف اسوي طلب إجازة أمومة من البوابة؟","يمكن تسجيل طلب إجازة أمومة من خلال البوابة عن طريق الخطوات التالية:

الدخول إلى النظام ومن ثم البوابة الرئيسة للموارد البشرية.
اختيار قائمة خدماتي – طلبات الموظف – خدمة تقديم طلب إجازة أمومة.
تعبئة الحقول المطلوبة في الطلب وإرفاق ما يثبت الحمل من مستشفى حكومي أو خاص، أو ما يثبت الولادة عند تسجيل طلب إجازة وضع.
إرسال الطلب للموافقة عليه من قبل المعنيين.

المصدر: [الأسئلة الشائعة]","success","15694","2026-04-14T19:33:48.150Z",""
